University,Research-15,Research-16,,,B2-C2,B2-C2/B2,,,,ABS
Harvard UniversityUnited States of America,98.6,99,,,-0.4,-0.004056795,1.64576E-05,,,0.004056795
University of OxfordUnited Kingdom,97.7,98.9,,,-1.2,-0.012282497,0.00015086,,,0.012282497
California Institute of TechnologyUnited States of America,98.1,97.6,,,0.5,0.00509684,2.59778E-05,,,0.00509684
University of CambridgeUnited Kingdom,95.6,96.7,,,-1.1,-0.011506276,0.000132394,,,0.011506276
Stanford UniversityUnited States of America,96.7,96.2,,,0.5,0.005170631,2.67354E-05,,,0.005170631
ETH Zurich – Swiss Federal Institute of Technology ZurichSwitzerland,90.2,95,,,-4.8,-0.053215078,0.002831844,,,0.053215078
Princeton UniversityUnited States of America,94.7,91.9,,,2.8,0.029567054,0.000874211,,,0.029567054
"University of California, BerkeleyUnited States of America",96.7,91.1,,,5.6,0.057911065,0.003353691,,,0.057911065
University College LondonUnited Kingdom,80.4,91,,,-10.6,-0.131840796,0.017381995,,,0.131840796
Johns Hopkins UniversityUnited States of America,84.2,90.4,,,-6.2,-0.073634204,0.005421996,,,0.073634204
University of TorontoCanada,85.1,89.3,,,-4.2,-0.049353702,0.002435788,,,0.049353702
University of ChicagoUnited States of America,89.9,88.9,,,1,0.011123471,0.000123732,,,0.011123471
Carnegie Mellon UniversityUnited States of America,74.9,88.8,,,-13.9,-0.185580774,0.034440224,,,0.185580774
"University of California, Los AngelesUnited States of America",90.5,88.6,,,1.9,0.020994475,0.000440768,,,0.020994475
Massachusetts Institute of TechnologyUnited States of America,88.2,80.4,,,7.8,0.088435374,0.007820815,,,0.088435374
Imperial College LondonUnited Kingdom,88.3,88.5,,,-0.2,-0.002265006,5.13025E-06,,,0.002265006
Yale UniversityUnited States of America,90.8,87.8,,,3,0.033039648,0.001091618,,,0.033039648
University of PennsylvaniaUnited States of America,82,86.9,,,-4.9,-0.059756098,0.003570791,,,0.059756098
Cornell UniversityUnited States of America,83.8,86.1,,,-2.3,-0.027446301,0.000753299,,,0.027446301
University of MichiganUnited States of America,86.5,85.2,,,1.3,0.015028902,0.000225868,,,0.015028902
National University of SingaporeSingapore,78.1,84.5,,,-6.4,-0.081946223,0.006715183,,,0.081946223
University of TokyoJapan,85.1,83,,,2.1,0.024676851,0.000608947,,,0.024676851
Tsinghua UniversityChina,68.3,83,,,-14.7,-0.21522694,0.046322636,,,0.21522694
Columbia UniversityUnited States of America,79.4,82.2,,,-2.8,-0.035264484,0.001243584,,,0.035264484
University of Illinois at Urbana-ChampaignUnited States of America,79,81.2,,,-2.2,-0.027848101,0.000775517,,,0.027848101
Karolinska InstituteSweden,68,81.1,,,-13.1,-0.192647059,0.037112889,,,0.192647059
London School of Economics and Political ScienceUnited Kingdom,74.2,80.6,,,-6.4,-0.086253369,0.007439644,,,0.086253369
Northwestern UniversityUnited States of America,78.9,78.4,,,0.5,0.006337136,4.01593E-05,,,0.006337136
Duke UniversityUnited States of America,75.2,78,,,-2.8,-0.037234043,0.001386374,,,0.037234043
LMU MunichGermany,69.1,77.4,,,-8.3,-0.120115774,0.014427799,,,0.120115774
Australian National UniversityAustralia,70.9,77.3,,,-6.4,-0.090267983,0.008148309,,,0.090267983
University of EdinburghUnited Kingdom,62.9,77.2,,,-14.3,-0.227344992,0.051685745,,,0.227344992
Humboldt University of BerlinGermany,52.6,77,,,-24.4,-0.463878327,0.215183102,,,0.463878327
KU LeuvenBelgium,63.6,76.9,,,-13.3,-0.209119497,0.043730964,,,0.209119497
King’s College LondonUnited Kingdom,62.3,75.8,,,-13.5,-0.216693419,0.046956038,,,0.216693419
University of MelbourneAustralia,70.9,75.5,,,-4.6,-0.064880113,0.004209429,,,0.064880113
Delft University of TechnologyNetherlands,71.4,73.8,,,-2.4,-0.033613445,0.001129864,,,0.033613445
University of British ColumbiaCanada,69,73.2,,,-4.2,-0.060869565,0.003705104,,,0.060869565
University of Hong KongHong Kong,72.6,72.8,,,-0.2,-0.002754821,7.58904E-06,,,0.002754821
Georgia Institute of TechnologyUnited States of America,71.2,72.7,,,-1.5,-0.021067416,0.000443836,,,0.021067416
"University of California, DavisUnited States of America",59.7,72.7,,,-13,-0.217755444,0.047417433,,,0.217755444
Peking UniversityChina,61.9,72.4,,,-10.5,-0.169628433,0.028773805,,,0.169628433
New York UniversityUnited States of America,62.4,72.3,,,-9.9,-0.158653846,0.025171043,,,0.158653846
Free University of BerlinGermany,58,72.2,,,-14.2,-0.244827586,0.059940547,,,0.244827586
McGill UniversityCanada,69.9,72.1,,,-2.2,-0.031473534,0.000990583,,,0.031473534
Seoul National UniversitySouth Korea,77.1,70.5,,,6.6,0.085603113,0.007327893,,,0.085603113
University of WashingtonUnited States of America,68.9,70,,,-1.1,-0.015965167,0.000254887,,,0.015965167
"University of California, San DiegoUnited States of America",66.6,69.8,,,-3.2,-0.048048048,0.002308615,,,0.048048048
University of Texas at AustinUnited States of America,72,69.7,,,2.3,0.031944444,0.001020448,,,0.031944444
Heidelberg UniversityGermany,45.4,69.6,,,-24.2,-0.533039648,0.284131266,,,0.533039648
Kyoto UniversityJapan,68.4,69.3,,,-0.9,-0.013157895,0.00017313,,,0.013157895
University of Wisconsin-MadisonUnited States of America,71.3,68.2,,,3.1,0.043478261,0.001890359,,,0.043478261
University of SydneyAustralia,60.8,68.1,,,-7.3,-0.120065789,0.014415794,,,0.120065789
École Polytechnique Fédérale de LausanneSwitzerland,56.9,67.5,,,-10.6,-0.18629174,0.034704612,,,0.18629174
Wageningen University and Research CenterNetherlands,46.8,66.9,,,-20.1,-0.429487179,0.184459237,,,0.429487179
Lomonosov Moscow State UniversityRussian Federation,42.1,66.7,,,-24.6,-0.58432304,0.341433416,,,0.58432304
Hong Kong University of Science and TechnologyHong Kong,66.8,66.1,,,0.7,0.010479042,0.00010981,,,0.010479042
"University of California, Santa BarbaraUnited States of America",61.4,66,,,-4.6,-0.074918567,0.005612792,,,0.074918567
University of ManchesterUnited Kingdom,58.7,66,,,-7.3,-0.124361158,0.015465698,,,0.124361158
Technical University of MunichGermany,37.4,66,,,-28.6,-0.764705882,0.584775087,,,0.764705882
University of AmsterdamNetherlands,55.4,64.7,,,-9.3,-0.167870036,0.028180349,,,0.167870036
Utrecht UniversityNetherlands,54.8,64.3,,,-9.5,-0.173357664,0.03005288,,,0.173357664
Leiden UniversityNetherlands,58.2,63.1,,,-4.9,-0.08419244,0.007088367,,,0.08419244
The University of QueenslandAustralia,58.4,62.8,,,-4.4,-0.075342466,0.005676487,,,0.075342466
Pennsylvania State UniversityUnited States of America,64.8,61.9,,,2.9,0.044753086,0.002002839,,,0.044753086
Nanyang Technological UniversitySingapore,55.9,61.3,,,-5.4,-0.096601073,0.009331767,,,0.096601073
University of MinnesotaUnited States of America,64.7,61,,,3.7,0.057187017,0.003270355,,,0.057187017
Uppsala UniversitySweden,53,61,,,-8,-0.150943396,0.022783909,,,0.150943396
University of HelsinkiFinland,48.1,60.4,,,-12.3,-0.255717256,0.065391315,,,0.255717256
University of TübingenGermany,44.7,59.8,,,-15.1,-0.337807606,0.114113979,,,0.337807606
University of Southern CaliforniaUnited States of America,44.6,58.9,,,-14.3,-0.320627803,0.102802188,,,0.320627803
Monash UniversityAustralia,54.4,58.5,,,-4.1,-0.075367647,0.005680282,,,0.075367647
National Taiwan UniversityTaiwan,57.3,58,,,-0.7,-0.012216405,0.000149241,,,0.012216405
Purdue UniversityUnited States of America,50.5,57.7,,,-7.2,-0.142574257,0.020327419,,,0.142574257
University of São PauloBrazil,51.6,57.1,,,-5.5,-0.106589147,0.011361246,,,0.106589147
University of GroningenNetherlands,50.8,56.9,,,-6.1,-0.12007874,0.014418904,,,0.12007874
University of FloridaUnited States of America,52.1,56.8,,,-4.7,-0.090211132,0.008138048,,,0.090211132
RWTH Aachen UniversityGermany,29.9,56.3,,,-26.4,-0.882943144,0.779588595,,,0.882943144
Brown UniversityUnited States of America,54.2,55.7,,,-1.5,-0.027675277,0.000765921,,,0.027675277
"Rutgers, the State University of New JerseyUnited States of America",45.3,55.7,,,-10.4,-0.229580574,0.05270724,,,0.229580574
Washington University in St LouisUnited States of America,55.2,55.6,,,-0.4,-0.007246377,5.251E-05,,,0.007246377
Erasmus University RotterdamNetherlands,53.7,55.2,,,-1.5,-0.027932961,0.00078025,,,0.027932961
University of North Carolina at Chapel HillUnited States of America,58.6,54.5,,,4.1,0.06996587,0.004895223,,,0.06996587
Ghent UniversityBelgium,51.6,54.5,,,-2.9,-0.05620155,0.003158614,,,0.05620155
University of GöttingenGermany,48,54.5,,,-6.5,-0.135416667,0.018337674,,,0.135416667
University of New South WalesAustralia,51.9,53.9,,,-2,-0.038535645,0.001484996,,,0.038535645
Lund UniversitySweden,48.5,53.6,,,-5.1,-0.105154639,0.011057498,,,0.105154639
Sungkyunkwan University (SKKU)South Korea,50.2,53.5,,,-3.3,-0.065737052,0.00432136,,,0.065737052
Scuola Normale Superiore di PisaItaly,46,53.1,,,-7.1,-0.154347826,0.023823251,,,0.154347826
University of WarwickUnited Kingdom,45.8,53.1,,,-7.3,-0.159388646,0.025404741,,,0.159388646
Michigan State UniversityUnited States of America,49.4,52.6,,,-3.2,-0.064777328,0.004196102,,,0.064777328
Texas A&M UniversityUnited States of America,51.9,52.4,,,-0.5,-0.009633911,9.28122E-05,,,0.009633911
Durham UniversityUnited Kingdom,40.7,51.9,,,-11.2,-0.275184275,0.075726385,,,0.275184275
University of BristolUnited Kingdom,44.7,51.6,,,-6.9,-0.154362416,0.023827756,,,0.154362416
Stockholm UniversitySweden,45,51.2,,,-6.2,-0.137777778,0.018982716,,,0.137777778
University of FreiburgGermany,28.1,51.1,,,-23,-0.818505338,0.669950988,,,0.818505338
Tel Aviv UniversityIsrael,51.1,50.5,,,0.6,0.011741683,0.000137867,,,0.011741683
University of ViennaAustria,39.7,50.5,,,-10.8,-0.272040302,0.074005926,,,0.272040302
University of PittsburghUnited States of America,46.3,50.3,,,-4,-0.086393089,0.007463766,,,0.086393089
Boston UniversityUnited States of America,46.7,49.5,,,-2.8,-0.059957173,0.003594863,,,0.059957173
University of SheffieldUnited Kingdom,39.1,48.8,,,-9.7,-0.248081841,0.0615446,,,0.248081841
Chinese University of Hong KongHong Kong,53.5,48.5,,,5,0.093457944,0.008734387,,,0.093457944
Radboud University NijmegenNetherlands,46.7,48.5,,,-1.8,-0.038543897,0.001485632,,,0.038543897
University of GlasgowUnited Kingdom,40.5,48.3,,,-7.8,-0.192592593,0.037091907,,,0.192592593
University of AlbertaCanada,47.1,48.1,,,-1,-0.021231423,0.000450773,,,0.021231423
University of Notre DameUnited States of America,38.5,48.1,,,-9.6,-0.249350649,0.062175746,,,0.249350649
Maastricht UniversityNetherlands,48.1,47.7,,,0.4,0.008316008,6.9156E-05,,,0.008316008
École Normale SupérieureFrance,36.2,47.7,,,-11.5,-0.317679558,0.100920302,,,0.317679558
Tokyo Institute of TechnologyJapan,52.9,47.6,,,5.3,0.100189036,0.010037843,,,0.100189036
Karlsruhe Institute of TechnologyGermany,34.9,47.5,,,-12.6,-0.361031519,0.130343757,,,0.361031519
University of BonnGermany,22.2,47.5,,,-25.3,-1.13963964,1.298778508,,,1.13963964
University of St AndrewsUnited Kingdom,35.9,47.3,,,-11.4,-0.317548747,0.100837206,,,0.317548747
Indian Institute of ScienceIndia,39.5,47.2,39.5,47.2,-7.7,-0.194936709,0.03800032,,,0.194936709
Pohang University of Science and TechnologySouth Korea,49.3,47.1,,,2.2,0.044624746,0.001991368,,,0.044624746
Tilburg UniversityNetherlands,45.1,47.1,,,-2,-0.044345898,0.001966559,,,0.044345898
University of KonstanzGermany,33.4,46.7,,,-13.3,-0.398203593,0.158566101,,,0.398203593
Ohio State UniversityUnited States of America,51.1,46.6,,,4.5,0.088062622,0.007755025,,,0.088062622
University of YorkUnited Kingdom,33.8,46.3,,,-12.5,-0.369822485,0.136768671,,,0.369822485
Bielefeld UniversityGermany,19.1,46.2,,,-27.1,-1.418848168,2.013130123,,,1.418848168
University of Western AustraliaAustralia,38.1,46.1,,,-8,-0.209973753,0.044088977,,,0.209973753
Zhejiang UniversityChina,33.1,46,,,-12.9,-0.389728097,0.151887989,,,0.389728097
TU Dresden Germany,42,45.8,,,-3.8,-0.09047619,0.008185941,,,0.09047619
University of TwenteNetherlands,45.3,45.6,,,-0.3,-0.006622517,4.38577E-05,,,0.006622517
University of LausanneSwitzerland,39.9,45.6,,,-5.7,-0.142857143,0.020408163,,,0.142857143
University of MontrealCanada,44.4,45.5,,,-1.1,-0.024774775,0.000613789,,,0.024774775
National Chiao Tung UniversityTaiwan,40.7,45.4,,,-4.7,-0.115479115,0.013335426,,,0.115479115
Osaka UniversityJapan,48,45.2,,,2.8,0.058333333,0.003402778,,,0.058333333
Shanghai Jiao Tong UniversityChina,37.9,45.2,,,-7.3,-0.192612137,0.037099435,,,0.192612137
McMaster UniversityCanada,43.2,44.8,,,-1.6,-0.037037037,0.001371742,,,0.037037037
University of OsloNorway,35.2,44.7,,,-9.5,-0.269886364,0.072838649,,,0.269886364
École PolytechniqueFrance,47.1,44.6,,,2.5,0.053078556,0.002817333,,,0.053078556
University of StuttgartGermany,17.3,44.5,,,-27.2,-1.572254335,2.471983695,,,1.572254335
KTH Royal Institute of TechnologySweden,44.8,44.3,,,0.5,0.011160714,0.000124562,,,0.011160714
Vanderbilt UniversityUnited States of America,38.2,44.2,,,-6,-0.157068063,0.024670376,,,0.157068063
University of MünsterGermany,18.1,44.1,,,-26,-1.436464088,2.063429077,,,1.436464088
University of WaterlooCanada,40.4,43.9,,,-3.5,-0.086633663,0.007505392,,,0.086633663
University of SouthamptonUnited Kingdom,34.1,43.6,,,-9.5,-0.278592375,0.077613712,,,0.278592375
Korea UniversitySouth Korea,44.3,43.4,,,0.9,0.020316027,0.000412741,,,0.020316027
University of AdelaideAustralia,40.4,43.2,,,-2.8,-0.069306931,0.004803451,,,0.069306931
Technical University of DarmstadtGermany,33.7,43.2,,,-9.5,-0.28189911,0.079467108,,,0.28189911
National Taiwan University of Science and Technology (Taiwan Tech)Taiwan,42.6,43.1,,,-0.5,-0.011737089,0.000137759,,,0.011737089
Tohoku UniversityJapan,47.3,42.7,,,4.6,0.097251586,0.009457871,,,0.097251586
University of CopenhagenDenmark,34.4,42.7,,,-8.3,-0.24127907,0.05821559,,,0.24127907
University of BernSwitzerland,36.9,42.5,,,-5.6,-0.151761518,0.023031558,,,0.151761518
State University of CampinasBrazil,38.8,42.3,,,-3.5,-0.090206186,0.008137156,,,0.090206186
"University of Maryland, College ParkUnited States of America",39.1,42.1,,,-3,-0.076726343,0.005886932,,,0.076726343
University of ArizonaUnited States of America,51.4,41.8,,,9.6,0.186770428,0.034883193,,,0.186770428
"University of California, IrvineUnited States of America",41.7,41.8,,,-0.1,-0.002398082,5.7508E-06,,,0.002398082
University of BirminghamUnited Kingdom,39.8,41.8,,,-2,-0.050251256,0.002525189,,,0.050251256
Hebrew University of JerusalemIsrael,36.3,41.4,,,-5.1,-0.140495868,0.019739089,,,0.140495868
Lancaster UniversityUnited Kingdom,36.1,41.4,,,-5.3,-0.146814404,0.021554469,,,0.146814404
Queen Mary University of LondonUnited Kingdom,32.9,41.3,,,-8.4,-0.255319149,0.065187868,,,0.255319149
Eindhoven University of TechnologyNetherlands,47.1,41,,,6.1,0.129511677,0.016773275,,,0.129511677
University of AntwerpBelgium,33.6,40.8,,,-7.2,-0.214285714,0.045918367,,,0.214285714
Université Catholique de LouvainBelgium,34.9,40.6,,,-5.7,-0.163323782,0.026674658,,,0.163323782
Korea Advanced Institute of Science and Technology (KAIST)South Korea,63.2,40.5,,,22.7,0.359177215,0.129008272,,,0.359177215
University of GenevaSwitzerland,37.2,40.5,,,-3.3,-0.088709677,0.007869407,,,0.088709677
National Cheng Kung UniversityTaiwan,40.1,40.2,,,-0.1,-0.002493766,6.21887E-06,,,0.002493766
University of ExeterUnited Kingdom,32.7,40,,,-7.3,-0.22324159,0.049836808,,,0.22324159
Autonomous University of BarcelonaSpain,29.2,40,,,-10.8,-0.369863014,0.136798649,,,0.369863014
University of GothenburgSweden,38.2,39.8,,,-1.6,-0.041884817,0.001754338,,,0.041884817
University of Erlangen-NurembergGermany,15.3,39.7,,,-24.4,-1.594771242,2.543295314,,,1.594771242
University of AucklandNew Zealand,33.4,39.5,,,-6.1,-0.182634731,0.033355445,,,0.182634731
Georgetown UniversityUnited States of America,28.2,39.3,,,-11.1,-0.393617021,0.154934359,,,0.393617021
Aarhus UniversityDenmark,47.5,39.2,,,8.3,0.174736842,0.030532964,,,0.174736842
University of LeedsUnited Kingdom,39.1,39,,,0.1,0.002557545,6.54104E-06,,,0.002557545
University of NottinghamUnited Kingdom,35.8,39,,,-3.2,-0.089385475,0.007989763,,,0.089385475
Nagoya UniversityJapan,31.8,38.9,,,-7.1,-0.22327044,0.049849689,,,0.22327044
University of Cape TownSouth Africa,35.3,38.7,,,-3.4,-0.09631728,0.009277019,,,0.09631728
University College DublinRepublic of Ireland,28.1,38.5,,,-10.4,-0.370106762,0.136979015,,,0.370106762
Virginia Polytechnic Institute and State UniversityUnited States of America,40,38.2,,,1.8,0.045,0.002025,,,0.045
Arizona State UniversityUnited States of America,37.5,38.1,,,-0.6,-0.016,0.000256,,,0.016
University of CologneGermany,18.4,38,,,-19.6,-1.065217391,1.134688091,,,1.065217391
University at BuffaloUnited States of America,39.8,37.9,,,1.9,0.047738693,0.002278983,,,0.047738693
University of Colorado BoulderUnited States of America,38.3,37.6,,,0.7,0.018276762,0.00033404,,,0.018276762
University of VirginiaUnited States of America,35.9,37.5,,,-1.6,-0.044568245,0.001986328,,,0.044568245
University of BarcelonaSpain,28.8,37.4,,,-8.6,-0.298611111,0.089168596,,,0.298611111
University of ReadingUnited Kingdom,34,37.3,,,-3.3,-0.097058824,0.009420415,,,0.097058824
Sapienza University of RomeItaly,28.1,37.3,,,-9.2,-0.327402135,0.107192158,,,0.327402135
University of SussexUnited Kingdom,30.4,37.2,,,-6.8,-0.223684211,0.050034626,,,0.223684211
VU University AmsterdamNetherlands,43.2,37.1,,,6.1,0.141203704,0.019938486,,,0.141203704
Emory UniversityUnited States of America,32.4,37.1,,,-4.7,-0.145061728,0.021042905,,,0.145061728
University of OttawaCanada,34.7,36.7,,,-2,-0.057636888,0.003322011,,,0.057636888
University of CalgaryCanada,30.5,36.7,,,-6.2,-0.203278689,0.041322225,,,0.203278689
National Tsing Hua UniversityTaiwan,40.3,36.6,,,3.7,0.091811414,0.008429336,,,0.091811414
University of Science and Technology of ChinaChina,27.3,36.6,,,-9.3,-0.340659341,0.116048786,,,0.340659341
University of LiègeBelgium,18.4,36.6,,,-18.2,-0.989130435,0.978379017,,,0.989130435
University of MassachusettsUnited States of America,49.1,36.3,,,12.8,0.260692464,0.067960561,,,0.260692464
Dartmouth CollegeUnited States of America,35.4,35.8,,,-0.4,-0.011299435,0.000127677,,,0.011299435
Queen’s UniversityCanada,33.4,35.8,,,-2.4,-0.071856287,0.005163326,,,0.071856287
University of WürzburgGermany,17.3,35.8,,,-18.5,-1.069364162,1.143539711,,,1.069364162
University of South FloridaUnited States of America,37.9,35.7,,,2.2,0.058047493,0.003369511,,,0.058047493
Queensland University of TechnologyAustralia,36,35.6,,,0.4,0.011111111,0.000123457,,,0.011111111
University of Hawai’i at MānoaUnited States of America,30.7,35.5,,,-4.8,-0.156351792,0.024445883,,,0.156351792
University of UtahUnited States of America,36.5,35.3,,,1.2,0.032876712,0.001080878,,,0.032876712
State University of New York AlbanyUnited States of America,35,35.3,,,-0.3,-0.008571429,7.34694E-05,,,0.008571429
Chalmers University of TechnologySweden,32.8,35.3,,,-2.5,-0.076219512,0.005809414,,,0.076219512
Hong Kong Polytechnic UniversityHong Kong,36.5,35.2,,,1.3,0.035616438,0.001268531,,,0.035616438
Rice UniversityUnited States of America,37.1,35.1,,,2,0.053908356,0.002906111,,,0.053908356
"Birkbeck, University of LondonUnited Kingdom",29.3,35.1,,,-5.8,-0.197952218,0.039185081,,,0.197952218
Stellenbosch UniversitySouth Africa,31.2,35,,,-3.8,-0.121794872,0.014833991,,,0.121794872
"University of California, Santa CruzUnited States of America",31.9,34.2,,,-2.3,-0.072100313,0.005198455,,,0.072100313
Yonsei UniversitySouth Korea,45.8,34.1,,,11.7,0.255458515,0.065259053,,,0.255458515
University of DelawareUnited States of America,36.3,34,,,2.3,0.063360882,0.004014601,,,0.063360882
Technion Israel Institute of TechnologyIsrael,37.5,33.3,,,4.2,0.112,0.012544,,,0.112
Tufts UniversityUnited States of America,33.9,33.3,,,0.6,0.017699115,0.000313259,,,0.017699115
University of EssexUnited Kingdom,29,33.3,,,-4.3,-0.148275862,0.021985731,,,0.148275862
"University of California, RiversideUnited States of America",27.5,33.3,,,-5.8,-0.210909091,0.044482645,,,0.210909091
Queen’s University BelfastUnited Kingdom,25.1,33.3,,,-8.2,-0.326693227,0.106728465,,,0.326693227
Case Western Reserve UniversityUnited States of America,37.4,33.2,,,4.2,0.112299465,0.01261117,,,0.112299465
"Royal Holloway, University of LondonUnited Kingdom",22.4,33.2,,,-10.8,-0.482142857,0.232461735,,,0.482142857
University of BaselSwitzerland,41.1,33.1,,,8,0.194647202,0.037887533,,,0.194647202
National Sun Yat-Sen UniversityTaiwan,32.9,33,,,-0.1,-0.003039514,9.23864E-06,,,0.003039514
Colorado State UniversityUnited States of America,31.3,33,,,-1.7,-0.054313099,0.002949913,,,0.054313099
University of FribourgSwitzerland,19.7,32.9,,,-13.2,-0.670050761,0.448968023,,,0.670050761
Aalto UniversityFinland,31.3,32.8,,,-1.5,-0.047923323,0.002296645,,,0.047923323
Hokkaido UniversityJapan,27.5,32.8,,,-5.3,-0.192727273,0.037143802,,,0.192727273
Swedish University of Agricultural SciencesSweden,25.2,32.8,,,-7.6,-0.301587302,0.0909549,,,0.301587302
Pierre and Marie Curie UniversityFrance,30,32.7,,,-2.7,-0.09,0.0081,,,0.09
University of BremenGermany,27.6,32.7,,,-5.1,-0.184782609,0.034144612,,,0.184782609
Hanyang UniversitySouth Korea,32.3,32.6,,,-0.3,-0.009287926,8.62656E-05,,,0.009287926
University of Western OntarioCanada,35.7,32.4,,,3.3,0.092436975,0.008544594,,,0.092436975
Sabancı UniversityTurkey,27.1,32.3,,,-5.2,-0.191881919,0.036818671,,,0.191881919
Nanjing UniversityChina,23.3,32.2,,,-8.9,-0.381974249,0.145904327,,,0.381974249
Vienna University of TechnologyAustria,32.4,32,,,0.4,0.012345679,0.000152416,,,0.012345679
Laval UniversityCanada,29.9,31.7,,,-1.8,-0.060200669,0.003624121,,,0.060200669
Polytechnic University of MilanItaly,26.6,31.7,,,-5.1,-0.191729323,0.036760133,,,0.191729323
Cardiff UniversityUnited Kingdom,30.4,31.6,,,-1.2,-0.039473684,0.001558172,,,0.039473684
University of ZurichSwitzerland,33.1,31.5,,,1.6,0.048338369,0.002336598,,,0.048338369
University of BergenNorway,27.9,31.5,,,-3.6,-0.129032258,0.016649324,,,0.129032258
Rensselaer Polytechnic InstituteUnited States of America,26.2,31.5,,,-5.3,-0.202290076,0.040921275,,,0.202290076
University of the WitwatersrandSouth Africa,21.7,31.5,,,-9.8,-0.451612903,0.203954214,,,0.451612903
University of AberdeenUnited Kingdom,30.2,31.4,,,-1.2,-0.039735099,0.001578878,,,0.039735099
Bayreuth UniversityGermany,12.9,31.2,,,-18.3,-1.418604651,2.012439156,,,1.418604651
University of LiverpoolUnited Kingdom,33.2,30.9,,,2.3,0.069277108,0.004799318,,,0.069277108
Autonomous University of MadridSpain,19.3,30.9,,,-11.6,-0.601036269,0.361244597,,,0.601036269
York UniversityCanada,35.3,30.8,,,4.5,0.127478754,0.016250833,,,0.127478754
Trinity College DublinRepublic of Ireland,30.3,30.8,,,-0.5,-0.01650165,0.000272304,,,0.01650165
Novosibirsk State UniversityRussian Federation,17.2,30.8,,,-13.6,-0.790697674,0.625202812,,,0.790697674
University of GeorgiaUnited States of America,28.9,30.5,,,-1.6,-0.055363322,0.003065097,,,0.055363322
University of OtagoNew Zealand,27.7,30.5,,,-2.8,-0.101083032,0.010217779,,,0.101083032
Fudan UniversityChina,34,30.4,,,3.6,0.105882353,0.011211073,,,0.105882353
Colorado School of MinesUnited States of America,26.7,30.3,,,-3.6,-0.134831461,0.018179523,,,0.134831461
University of Nebraska-LincolnUnited States of America,24.4,30.2,,,-5.8,-0.237704918,0.056503628,,,0.237704918
Sharif University of TechnologyIran,34.7,30.1,,,4.6,0.132564841,0.017573437,,,0.132564841
École Normale Supérieure de LyonFrance,33.8,30,,,3.8,0.112426036,0.012639613,,,0.112426036
University of VictoriaCanada,30.6,30,,,0.6,0.019607843,0.000384468,,,0.019607843
Ruhr University BochumGermany,22.5,30,,,-7.5,-0.333333333,0.111111111,,,0.333333333
University of TsukubaJapan,21.6,30,,,-8.4,-0.388888889,0.151234568,,,0.388888889
Technical University of DenmarkDenmark,28.2,29.9,,,-1.7,-0.060283688,0.003634123,,,0.060283688
University of BolognaItaly,23.2,29.5,,,-6.3,-0.271551724,0.073740339,,,0.271551724
Iowa State UniversityUnited States of America,30.9,29.4,,,1.5,0.048543689,0.00235649,,,0.048543689
Dalhousie UniversityCanada,30,29.4,,,0.6,0.02,0.0004,,,0.02
Boston CollegeUnited States of America,29.1,29.3,,,-0.2,-0.006872852,4.72361E-05,,,0.006872852
University of Illinois at ChicagoUnited States of America,34.1,29.2,,,4.9,0.143695015,0.020648257,,,0.143695015
Simon Fraser UniversityCanada,29.3,29.2,,,0.1,0.003412969,1.16484E-05,,,0.003412969
Paris-Sud UniversityFrance,33.1,29,,,4.1,0.123867069,0.015343051,,,0.123867069
Victoria University of WellingtonNew Zealand,28.5,28.7,,,-0.2,-0.007017544,4.92459E-05,,,0.007017544
University of East AngliaUnited Kingdom,22.6,28.7,,,-6.1,-0.269911504,0.07285222,,,0.269911504
Indian Institute of Technology BombayIndia,24.6,28.6,24.6,28.6,-4,-0.162601626,0.026439289,,,0.162601626
Goethe University FrankfurtGermany,22.4,28.6,,,-6.2,-0.276785714,0.076610332,,,0.276785714
Oregon State UniversityUnited States of America,21.1,28.5,,,-7.4,-0.3507109,0.122998136,,,0.3507109
Aalborg UniversityDenmark,28.5,28.4,,,0.1,0.003508772,1.23115E-05,,,0.003508772
University of WollongongAustralia,27.8,28.4,,,-0.6,-0.021582734,0.000465814,,,0.021582734
Université Libre de BruxellesBelgium,36.2,28.3,,,7.9,0.218232044,0.047625225,,,0.218232044
Washington State UniversityUnited States of America,27.5,28.2,,,-0.7,-0.025454545,0.000647934,,,0.025454545
Pompeu Fabra UniversitySpain,28.3,28,,,0.3,0.010600707,0.000112375,,,0.010600707
University of RochesterUnited States of America,29.2,27.9,,,1.3,0.044520548,0.001982079,,,0.044520548
University of BathUnited Kingdom,25.1,27.9,,,-2.8,-0.111553785,0.012444247,,,0.111553785
University of LeicesterUnited Kingdom,31.6,27.8,,,3.8,0.120253165,0.014460824,,,0.120253165
Newcastle UniversityUnited Kingdom,29.6,27.5,,,2.1,0.070945946,0.005033327,,,0.070945946
Kyushu UniversityJapan,28.5,27.5,,,1,0.035087719,0.001231148,,,0.035087719
Lappeenranta University of TechnologyFinland,25.5,27.5,,,-2,-0.078431373,0.00615148,,,0.078431373
